{
  "schemaVersion": "clervo.supply-route-matrix.v1",
  "evaluatedAt": "2026-08-02T08:43:26.583Z",
  "policy": {
    "providerNamesPublic": false,
    "exactModelSubstitutionAllowed": false,
    "automaticPaidOverageAllowed": false,
    "customerFreeByDefault": false,
    "pricingIsReferencedNotDuplicated": true
  },
  "catalogCoverage": [
    {
      "catalog": "packages/catalog/ai-credit-backed-pricing.v1.json",
      "assetCount": 11,
      "positiveCustomerPriceCount": 11,
      "sellableCount": 9
    },
    {
      "catalog": "packages/catalog/ai-edge-free-pricing.v1.json",
      "assetCount": 61,
      "positiveCustomerPriceCount": 61,
      "sellableCount": 6
    },
    {
      "catalog": "packages/catalog/ai-free-tier-pricing.v1.json",
      "assetCount": 15,
      "positiveCustomerPriceCount": 15,
      "sellableCount": 3
    },
    {
      "catalog": "packages/catalog/ai-gateway-pricing.v1.json",
      "assetCount": 21,
      "positiveCustomerPriceCount": 21,
      "sellableCount": 0
    },
    {
      "catalog": "packages/catalog/ai-launch-pricing.v1.json",
      "assetCount": 3,
      "positiveCustomerPriceCount": 3,
      "sellableCount": 3
    },
    {
      "catalog": "packages/catalog/ai-owned-source-pricing.v1.json",
      "assetCount": 612,
      "positiveCustomerPriceCount": 612,
      "sellableCount": 0
    },
    {
      "catalog": "packages/catalog/ai-speech-pricing.v1.json",
      "assetCount": 3,
      "positiveCustomerPriceCount": 3,
      "sellableCount": 2
    },
    {
      "catalog": "packages/catalog/blockchain-data-supply-pricing.v1.json",
      "assetCount": 7,
      "positiveCustomerPriceCount": 7,
      "sellableCount": 3
    },
    {
      "catalog": "packages/catalog/payment-supply-pricing.v1.json",
      "assetCount": 4,
      "positiveCustomerPriceCount": 4,
      "sellableCount": 0
    },
    {
      "catalog": "packages/catalog/platform-integration-supply-pricing.v1.json",
      "assetCount": 8,
      "positiveCustomerPriceCount": 8,
      "sellableCount": 0
    },
    {
      "catalog": "packages/catalog/rpc-supply-pricing.v1.json",
      "assetCount": 46,
      "positiveCustomerPriceCount": 46,
      "sellableCount": 0
    },
    {
      "catalog": "packages/catalog/search-supply-pricing.v1.json",
      "assetCount": 2,
      "positiveCustomerPriceCount": 2,
      "sellableCount": 0
    },
    {
      "catalog": "packages/catalog/storage-supply-pricing.v1.json",
      "assetCount": 4,
      "positiveCustomerPriceCount": 4,
      "sellableCount": 0
    }
  ],
  "capabilities": [
    {
      "capabilityId": "ai.chat",
      "publicAssets": [
        "gemini-3.5-flash",
        "gemini-3.5-flash-lite",
        "gemini-3.6-flash",
        "gpt-5.6-luna",
        "gpt-5.6-sol",
        "gpt-5.6-terra",
        "gpt-oss-120b",
        "gpt-oss-20b",
        "llama-4-scout-17b-16e-instruct",
        "nemotron-3-120b-a12b",
        "qwen3-30b-a3b-fp8",
        "qwen3.6-27b"
      ],
      "lifecycle": "mixed",
      "routeState": "qualified_portfolio_exact_fallback_partial",
      "primaryServices": [
        "supply.clervo_ai_gateway",
        "supply.google_vertex",
        "supply.groq",
        "supply.cloudflare_workers_ai"
      ],
      "fallbackServices": [
        "supply.groq",
        "supply.cloudflare_workers_ai"
      ],
      "pricingCatalogs": [
        "packages/catalog/ai-launch-pricing.v1.json",
        "packages/catalog/ai-credit-backed-pricing.v1.json",
        "packages/catalog/ai-free-tier-pricing.v1.json",
        "packages/catalog/ai-edge-free-pricing.v1.json"
      ],
      "quality": "mixed",
      "termsStatus": "restricted",
      "quotaRunway": "Existing gateway budget, reported Vertex credit, recurring free allocations, and hard deny-on-unknown usage guards; exact expiry and remaining balances are not fully observable.",
      "healthMethod": [
        "docs/evidence/supply-foundation/cloudflare-production-chat-quality.v1.json",
        "docs/evidence/supply-foundation/cloudflare-expanded-chat-qualification.v1.json",
        "docs/evidence/stage6/groq-supply-screen.v1.json",
        "docs/evidence/stage6/vertex-multimodal-screen.v1.json"
      ],
      "secretLocations": [
        "runtime:CLERVO_AI_API_KEY",
        "application_default:GCP_ADC",
        "legacy_import:GROQ_API_KEY,CLOUDFLARE_API_TOKEN"
      ],
      "replacementPlan": "Retain only exact qualified identities. Add official paid supplier accounts after revenue, prioritizing missing proprietary families; never use opaque or silently substituting aggregators."
    },
    {
      "capabilityId": "ai.embed",
      "publicAssets": [
        "gemini-embedding-001"
      ],
      "lifecycle": "production",
      "routeState": "qualified_single_family",
      "primaryServices": [
        "supply.google_vertex"
      ],
      "fallbackServices": [],
      "pricingCatalogs": [
        "packages/catalog/ai-credit-backed-pricing.v1.json",
        "packages/catalog/ai-edge-free-pricing.v1.json"
      ],
      "quality": "best",
      "termsStatus": "restricted",
      "quotaRunway": "Allocated from the reported Vertex credit with deny-on-unknown usage. The recurring-free BGE-M3 candidate passed 7/8 retrieval cases but its synchronous responses omit token usage, so it cannot enter customer accounting.",
      "healthMethod": [
        "docs/evidence/supply-foundation/cloudflare-modality-screen.v1.json",
        "docs/evidence/supply-foundation/cloudflare-bge-retrieval.v1.json",
        "docs/evidence/stage6/vertex-embedding-screen.v1.json"
      ],
      "secretLocations": [
        "application_default:GCP_ADC",
        "legacy_import:CLOUDFLARE_API_TOKEN"
      ],
      "replacementPlan": "Keep BGE-M3 blocked unless the synchronous API reports exact token usage or an exact compatible tokenizer is integrated; do not estimate metered usage. Source another independent embedding family only if funded Vertex runway becomes insufficient."
    },
    {
      "capabilityId": "ai.image",
      "publicAssets": [
        "gemini-3-pro-image",
        "gemini-3.1-flash-image",
        "gemini-3.1-flash-lite-image"
      ],
      "lifecycle": "production",
      "routeState": "qualified_single_family",
      "primaryServices": [
        "supply.google_vertex"
      ],
      "fallbackServices": [],
      "pricingCatalogs": [
        "packages/catalog/ai-credit-backed-pricing.v1.json",
        "packages/catalog/ai-edge-free-pricing.v1.json"
      ],
      "quality": "mixed",
      "termsStatus": "restricted",
      "quotaRunway": "Allocated from the reported Vertex credit; generated-image size and ledger ceilings remain mandatory.",
      "healthMethod": [
        "docs/evidence/supply-foundation/cloudflare-modality-screen.v1.json",
        "docs/evidence/supply-foundation/cloudflare-flux-safety-probe.v1.json",
        "docs/evidence/supply-foundation/cloudflare-flux-quality-final.v1.json",
        "docs/evidence/supply-foundation/cloudflare-dreamshaper-quality-final.v1.json",
        "docs/evidence/stage6/vertex-multimodal-screen.v1.json"
      ],
      "secretLocations": [
        "application_default:GCP_ADC",
        "legacy_import:CLOUDFLARE_API_TOKEN"
      ],
      "replacementPlan": "Keep FLUX Schnell and DreamShaper rejected after independent 1/5 prompt-adherence results, and keep the newer BFL routes terms-blocked; source a different zero-owner-cash image family only if the funded primary runway becomes insufficient."
    },
    {
      "capabilityId": "ai.video",
      "publicAssets": [
        "veo-3.1-fast-generate-001",
        "veo-3.1-generate-001"
      ],
      "lifecycle": "production",
      "routeState": "qualified_single_family",
      "primaryServices": [
        "supply.google_vertex"
      ],
      "fallbackServices": [],
      "pricingCatalogs": [
        "packages/catalog/ai-credit-backed-pricing.v1.json"
      ],
      "quality": "mixed",
      "termsStatus": "restricted",
      "quotaRunway": "USD 500 shadow allocation within the reported credit and USD 25 total daily shadow debit ceiling; no owner-cash overage.",
      "healthMethod": [
        "docs/evidence/stage6/vertex-multimodal-screen.v1.json"
      ],
      "secretLocations": [
        "application_default:GCP_ADC"
      ],
      "replacementPlan": "Keep the preview lite route unavailable and source a second production video family only after the primary route has customer demand."
    },
    {
      "capabilityId": "ai.music",
      "publicAssets": [
        "lyria-002"
      ],
      "lifecycle": "preview",
      "routeState": "qualified_adapter_ready_contract_pending",
      "primaryServices": [
        "supply.google_vertex"
      ],
      "fallbackServices": [],
      "pricingCatalogs": [
        "packages/catalog/ai-credit-backed-pricing.v1.json"
      ],
      "quality": "unranked",
      "termsStatus": "restricted",
      "quotaRunway": "USD 100 shadow allocation within the reported credit, USD 0.06 supplier price per 30-second clip, and the shared USD 25 daily debit ceiling; no owner-cash overage.",
      "healthMethod": [
        "docs/evidence/supply-foundation/vertex-lyria-qualification.v1.json",
        "tests/contract/vertex-lyria-adapter.test.mjs"
      ],
      "secretLocations": [
        "application_default:GCP_ADC"
      ],
      "replacementPlan": "Add the explicit ai.music execution wire contract and a perceptual quality benchmark before public listing; retain the exact immutable endpoint and WAV integrity checks."
    },
    {
      "capabilityId": "ai.tts",
      "publicAssets": [
        "aura-2-arcas-en",
        "aura-2-en",
        "aura-2-thalia-en"
      ],
      "lifecycle": "production",
      "routeState": "qualified_resilient",
      "primaryServices": [
        "supply.deepgram"
      ],
      "fallbackServices": [
        "supply.cloudflare_workers_ai"
      ],
      "pricingCatalogs": [
        "packages/catalog/ai-speech-pricing.v1.json",